{
  "api_version": "0.1.0",
  "generated_at": "unix:1",
  "target_id": "codex-cli",
  "repo_root": "/tmp/repo",
  "repo_root_hash": "sha256:aaaaaaaaaaaaaaaaaaaaaaaaaaaaaaaaaaaaaaaaaaaaaaaaaaaaaaaaaaaaaaaa",
  "cwd": "/tmp/repo",
  "scan_scope": "repo",
  "collector_status": "disabled",
  "usage_window": "present",
  "project_instruction_sources": [
    {
      "kind": "AGENTS.md",
      "scope": "repo",
      "path": "/tmp/repo/AGENTS.md",
      "hash": "sha256:bbbbbbbbbbbbbbbbbbbbbbbbbbbbbbbbbbbbbbbbbbbbbbbbbbbbbbbbbbbbbbbb"
    }
  ],
  "summary": {
    "total_skills": 2,
    "host_counts": {
      "codex-cli": 1,
      "metactl-generated": 1
    },
    "scope_counts": {
      "repo": 1,
      "generated": 1
    },
    "low_confidence_count": 0,
    "duplicate_cluster_count": 1,
    "relation_count": 2,
    "recommendation_counts": {
      "keep": 1,
      "repair_metadata": 1
    }
  },
  "inventory": [
    {
      "local_id": "sha256:aaaaaaaaaaaaaaaaaaaaaaaaaaaaaaaaaaaaaaaaaaaaaaaaaaaaaaaaaaaaaaaa",
      "name": "repo-local-skill",
      "target_kind": "codex-cli",
      "scope": "repo",
      "path": null,
      "path_hash": "sha256:bbbbbbbbbbbbbbbbbbbbbbbbbbbbbbbbbbbbbbbbbbbbbbbbbbbbbbbbbbbbbbbb",
      "source_pack_id": null,
      "source_library_ref": null,
      "source_visibility": null,
      "digest": "sha256:cccccccccccccccccccccccccccccccccccccccccccccccccccccccccccccccc",
      "tree_digest": "sha256:dddddddddddddddddddddddddddddddddddddddddddddddddddddddddddddddd",
      "frontmatter": {
        "name": "repo-local-skill",
        "description": "Repo-local skill fixture."
      },
      "validation_findings": [],
      "enabled": true,
      "discovery_evidence": ["filesystem discovery", "repo-local path"],
      "discovery_confidence": "high",
      "host_adapter": {
        "host": "codex-cli",
        "source_url": "docs/internal/host-adapter-matrix.md#codex-cli",
        "source_checked_at": "2026-06-14",
        "verified_by_test": true,
        "confidence": "medium"
      },
      "visibility": {
        "effective_visibility": "visible",
        "confidence": "medium",
        "notes": []
      },
      "usage_join": null
    }
  ],
  "relations": [],
  "recommendations": [
    {
      "action": "keep",
      "subject_ids": [
        "sha256:aaaaaaaaaaaaaaaaaaaaaaaaaaaaaaaaaaaaaaaaaaaaaaaaaaaaaaaaaaaaaaaa"
      ],
      "confidence": "medium",
      "reason_codes": [],
      "evidence": [],
      "next_reversible_action": "keep"
    }
  ],
  "action_plan": {
    "plan_id": "sha256:aaaaaaaaaaaaaaaaaaaaaaaaaaaaaaaaaaaaaaaaaaaaaaaaaaaaaaaaaaaaaaaa",
    "generated_at": "unix:1",
    "target_id": "codex-cli",
    "scan_scope": "repo",
    "approval_required": true,
    "mutation_allowed": false,
    "actions": []
  },
  "notes": ["usage_window: none"]
}
